{
  "sim": null,
  "gateway": null,
  "backend": {
    "schema": "urn:fdp:schema:status-backend:v1",
    "unit_id": "cau-7",
    "wall_ts": "2026-09-19T10:00:05.000Z",
    "backend": {
      "name": "von",
      "model": "von-1.13.0"
    },
    "decision": {
      "total": 42,
      "ok": 41,
      "failed": 1,
      "consecutive_errors": 0,
      "last_ok_wall_ts": "2026-09-19T09:59:58.412Z",
      "last_error_wall_ts": "2026-09-19T09:41:03.907Z"
    },
    "heartbeat": {
      "telemetry_silent": false,
      "decision_api_silent": false
    },
    "episodes_open": 2,
    "tickets_open": 1,
    "version": "1.0.0"
  },
  "alerts_active": [],
  "injections_active": [],
  "gate": {
    "ticket_min_confidence": 0.85,
    "review_min_confidence": 0.6
  }
}
